{
  "reviewer_role": "reader",
  "review_mode": "independent",
  "reviewer_run_id": "fixture-reader-run",
  "artifact_set_id": "fixture-artifact-set",
  "review_round": 1,
  "verdict": "PASS",
  "checks": [{"name": "reader gates", "result": "PASS", "reason": "fixture"}],
  "blocking_issues": [],
  "unsupported_claims": [],
  "missing_coverage": [],
  "required_fixes": []
}
